question,answer
ما هي الخدمات التي تقدمها شركة السياحة؟,نقدم خدمات حجز الرحلات السياحية وحجوزات الفنادق وبرامج السفر المتكاملة.
هل توفر الشركة رحلات داخلية داخل مصر؟,نعم نوفر رحلات سياحية داخلية إلى جميع المحافظات والمدن السياحية.
هل تشمل الرحلات مرشدين سياحيين؟,نعم تتضمن معظم برامجنا مرشدين سياحيين معتمدين.
كيف يمكنني حجز رحلة سياحية؟,يمكنك الحجز من خلال موقعنا الإلكتروني أو التواصل مع خدمة العملاء.
هل يمكن إلغاء الحجز بعد تأكيده؟,نعم يمكن الإلغاء وفقًا لشروط وسياسة الإلغاء الخاصة بكل رحلة.
هل تقدم الشركة رحلات خارجية؟,نعم نوفر رحلات سياحية إلى العديد من الدول حول العالم.
ما طرق الدفع المتاحة؟,نقبل الدفع نقدًا وبطاقات الائتمان والتحويل البنكي.
هل توجد عروض وخصومات موسمية؟,نعم نقدم عروضًا خاصة في المواسم السياحية المختلفة.
هل تشمل الرحلات تذاكر الطيران؟,بعض البرامج تشمل تذاكر الطيران والبعض الآخر لا.
كيف أعرف تفاصيل برنامج الرحلة؟,يمكنك الاطلاع على تفاصيل الرحلة كاملة قبل الحجز من خلال الموقع.
هل يمكن تخصيص برنامج سياحي خاص؟,نعم نوفر برامج سياحية مخصصة حسب رغبة العميل.
هل توفر الشركة رحلات شهر العسل؟,نعم لدينا برامج خاصة لرحلات شهر العسل.
هل تشمل الرحلات وجبات الطعام؟,يعتمد ذلك على نوع البرنامج ويتم توضيحه قبل الحجز.
ما هي سياسة الأطفال في الرحلات؟,تختلف سياسة الأطفال حسب الفندق وشركة الطيران.
هل يمكن تعديل تاريخ الرحلة؟,يمكن تعديل التاريخ حسب توفر الأماكن وشروط الرحلة.
هل الرحلات مناسبة لكبار السن؟,نعم نوفر برامج مناسبة لكبار السن.
هل تشمل الرحلات تأمين سفر؟,بعض البرامج تشمل تأمين السفر والبعض الآخر اختياري.
كيف أتواصل مع خدمة العملاء؟,يمكنك التواصل عبر الهاتف أو البريد الإلكتروني أو الواتساب.
هل توجد رحلات جماعية؟,نعم نوفر رحلات جماعية بأسعار مخفضة.
هل توفر الشركة حجوزات فنادق فقط؟,نعم يمكن حجز الفنادق بدون برامج سياحية.
هل الفنادق المعروضة معتمدة؟,نعم نتعامل فقط مع فنادق معتمدة.
هل الرحلات مناسبة للعائلات؟,نعم لدينا برامج مصممة خصيصًا للعائلات.
هل توجد رحلات تعليمية أو ثقافية؟,نعم نقدم رحلات ثقافية وتعليمية.
ما هي أفضل أوقات السفر؟,يعتمد ذلك على الوجهة ويتم إرشاد العميل حسب الموسم.
هل يمكن الدفع بالتقسيط؟,نعم نوفر أنظمة تقسيط لبعض البرامج.
هل تشمل الرحلات الانتقالات؟,نعم معظم الرحلات تشمل الانتقالات الداخلية.
هل يمكن حجز رحلة في نفس اليوم؟,ذلك يعتمد على توفر الأماكن.
هل تقدم الشركة رحلات مغامرات؟,نعم لدينا برامج سياحة المغامرات.
هل يمكن تغيير الفندق بعد الحجز؟,يمكن ذلك حسب التوفر وسياسة الفندق.
هل تقدم الشركة رحلات بحرية؟,نعم نوفر رحلات بحرية داخلية وخارجية.
هل يمكن استرداد المبلغ المدفوع؟,يتم الاسترداد حسب سياسة الإلغاء.
هل الرحلات مناسبة للأطفال؟,نعم توجد برامج مناسبة للأطفال.
هل توفر الشركة دعمًا أثناء الرحلة؟,نعم يتوفر دعم فني طوال مدة الرحلة.
هل تشمل الرحلات زيارات للأماكن السياحية؟,نعم يتم تنظيم زيارات لأهم المعالم.
هل يمكن السفر بدون مجموعة؟,نعم يمكن الحجز الفردي.
هل يوجد حد أدنى لعدد المسافرين؟,يعتمد ذلك على نوع الرحلة.
هل تقدم الشركة رحلات دينية؟,نعم نوفر رحلات دينية وزيارات مقدسة.
هل يمكن تغيير اسم المسافر؟,يمكن ذلك وفق شروط شركة الطيران.
هل يتم توفير سيارات خاصة؟,نعم تتوفر سيارات خاصة عند الطلب.
هل الرحلات مناسبة لذوي الاحتياجات الخاصة؟,نحاول توفير برامج مناسبة حسب الإمكانيات.
هل يمكن الحجز عبر الهاتف؟,نعم يمكن الحجز عبر الهاتف مباشرة.
هل توجد رسوم إضافية غير معلنة؟,لا يتم فرض أي رسوم غير موضحة مسبقًا.
